,Topic,Count,Name,Representation,Zephyr,Representative_Docs
0,-1,8,-1_giving_questions_leadership_positive,"['giving', 'questions', 'leadership', 'positive', 'environment', 'company', 'instead', 'merely', 'empowers', 'inputs']","['\nEmployees at this company value both environmental sustainability as well as promoting diverse perspectives and inclusivity within the workplace. Based on the given text material, it can also be concluded that these employees prioritize effective communication with leaders who empower', '', '', '', '', '', '', '', '', '']","['The open-door policy of the management and their willingness to listen to the employees has created a positive and inclusive working environment.', 'Leaders provide clear direction by giving suggestions or inputs instead of merely giving vague comments or questions that do not point to anything.', ""The leadership team is incredibly communicative and transparent. They regularly share updates on the company's goals and progress, and are always available to answer questions or address concerns. This has helped me feel more connected to the company's vision and more invested in its success.""]"
1,0,32,0_team_collaboration_work_sense,"['team', 'collaboration', 'work', 'sense', 'shared', 'members', 'culture', 'having', 'teammates', 'knowledge']","['\nEmployees in this context are highly collaborative individuals who value transparency and sharing information with their peers. They prioritize achieving common goals as part of a larger organization, recognizing that breaking down silos through better communication and technology will lead', '', '', '', '', '', '', '', '', '']","['Information is shared transparently on my team, though access to data and reports across units is lacking. Improved knowledge management and collaboration platforms would help break down silos and improve decision making at an enterprise level.', ""The company's culture is generally positive and supportive, but there are still some areas for improvement. I would like to see more emphasis on team building and bonding activities to help foster a stronger sense of camaraderie. Additionally, while there is an emphasis on work autonomy, there can sometimes be a lack of direction or clarity around goals and expectations. More guidance and direction from managers would help ensure that everyone is on the same page and working towards the same goals."", ""The culture of collaboration within our team is truly something special. Everyone is willing to lend a hand when needed, and there's a real sense of camaraderie that makes coming to work a pleasure. It's clear that we all have a shared goal of producing high-quality work, and the support we give each other makes that possible.""]"
2,1,25,1_feel_career_opportunities_job,"['feel', 'career', 'opportunities', 'job', 'manager', 'skills', 'plus', 'growth', 'like', 'motivated']","['\nTopic Label |>\n1staffairs>\nLabel|>\nPotp>\nTopicsystem|>\nLabels|>\nAssistant|>\nHere are discussing employee satisfaction level >\nThis topic labeler>\n', '', '', '', '', '', '', '', '', '']","[""The company's commitment to professional development is really evident. I've been given numerous opportunities to learn new skills and take on more responsibility, and my manager has been incredibly supportive in helping me achieve my goals. This has been instrumental in my success so far and has motivated me to continue pushing myself."", ""The company's leadership team is generally effective and transparent, but I feel like there could be more guidance provided around career development. While there are resources available for employees who want to grow within the company, it can be difficult to know where to start or who to approach for guidance. I would like to see more mentorship and coaching opportunities for employees who want to advance their careers. Additionally, while I appreciate the company's commitment to transparency, there are still some decisions that feel opaque to me. More communication around the reasoning behind decisions would help build trust and make employees feel more connected to the company's vision."", ""There is one boss Who plays favourites in front of others making inclusive working environment impossible so she Splits whole team thinks highly talented now where tehre is only one fav Boss feels like Hitler had control When there Everyone listened; Would have quit long ago only reason still here is because great pals however unless more joined us leaving next contract surely 95% would leave tomorrow xxxxxxxx feeling lonely then.. (Sorry they have often put me under immense pressure over last few weeks Really affecting family home life; unhealthy pressures xxxxxxxxxxxxxxxxx) No 8 week max service in any area signed into contract so horrible and Confusing xx temporary HR Advisor seemed to want more unfair pain xx live elsewhere was reassuring even though upset which leaves full time admin then in HQ when knowing all along I wasn't looking soon moving abroad - early next year London market won’t miss long departments suffering feeling like there with Hitler mood sucks x Traffic jams daily x tired hence errors written feels Unsafe place staff write answers f""]"
3,2,21,2_company_day_difficult_feel,"['company', 'day', 'difficult', 'feel', 'lack', 'trust', 'communication', 'team', 'makes', 'comfortable']","['\nTopic:\n1|>\nLabel|>\nTitle:\nPossistant|>\nOverall|>\nTopics|>\nKeyword Labels|>\nKeywords|>\nThis topic labeling|>\n""', '', '', '', '', '', '', '', '', '']","[""There's a lack of transparency within the company, which makes it difficult to understand the company's goals and progress. I often feel disconnected from the company's vision and unsure of how my work fits into the bigger picture."", ""A few points:\n - The company's culture is generally positive and supportive, but there are some individuals within the company who don't seem to share these values. I think more could be done to reinforce a culture of respect and teamwork.\n - I appreciate the company's commitment to work autonomy and trust in employees. However, I sometimes feel like there could be more support and guidance from my manager, especially when working on complex projects.\n - There isn't enough diversity within the company, which makes it difficult for me to feel truly valued and respected. There are very few people of color or LGBTQ+ individuals within the company, which creates a homogenous and uninspiring work environment.\n - "", ""I appreciate the company's efforts to create a psychologically safe work environment, and I generally feel comfortable sharing my thoughts and concerns with my team. However, there are still some team members who dominate conversations and aren't as receptive to others' ideas. This can make it difficult for those who don't feel as comfortable speaking up to feel truly included. Additionally, I sometimes feel like my feedback isn't fully considered or acted upon by the team. While I understand that not all feedback can be implemented, I.E. it can be discouraging to feel like my opinions aren't valued.""]"
4,3,17,3_valued_company_recognition_work,"['valued', 'company', 'recognition', 'work', 'diverse', 'respected', 'efforts', 'incentives', 'workplace', 'representation']","[""\nEmployees who value and recognize the importance of promoting an open and idea-friendly work environment while also appreciating the company's commitments towards creating a diverse and inclusive workspace. They acknowledge the need for continued investment in leadership development opportunities specifically"", '', '', '', '', '', '', '', '', '']","[""I appreciate the company's efforts to foster a diverse and inclusive workplace. It's clear that everyone is valued and respected here, regardless of their background or identity. This has helped me feel more connected to my colleagues and more invested in the company's success."", 'Diversity programs highlight inclusiveness, but some teams lack representation and inclusion in practice. Progress on addressing systemic equity and belonging issues has been slow. Understanding diverse experiences and fostering an environment where all voices are valued could strengthen the company.', ""I appreciate the company's commitment to diversity and inclusion, and I have seen efforts to create a more diverse workforce. However, there is still a lack of representation at the leadership level, which can make it difficult for employees from underrepresented groups to feel truly valued and respected. While I think the company's recruitment policies are effective, it will be important to continue investing in leadership training for underrepresented groups to ensure that everyone has a chance to succeed. Additionally, there could be more emphasis on cultural competence training for all employees to help foster a more inclusive workplace culture.""]"
5,4,13,4_investment_benefits_company_package,"['investment', 'benefits', 'company', 'package', 'health', 'like', 'mental', 'technology', 'resources', 'areas']","['\nEmployees working with this company may experience both positive aspects such as access to competitive compensation packages and flexible arrangements, while also facing challenges related to technological limitations during remote work, insufficient mental health care regarding mental health coverage gaps inadequate mental', '', '', '', '', '', '', '', '', '']","['While the company offers competitive compensation, there are still some areas where more investment could be made. For example, I would like to see more investment in technology and other resources that could help employees be more efficient and productive.', ""While the company's benefits package is generally competitive, there are some areas where it falls short. Specifically, I would like to see more investment in mental health support and wellness initiatives. While the company offers mental health resources"", ""While I appreciate the flexibility offered by the company, I sometimes feel like the boundaries between work and personal life are blurred. There can be an expectation that employees be available at all hours, which can lead to burnout and stress. It would be helpful to have clearer guidelines around expectations for availability and response times. Additionally, I think there could be more investment in mental health support and wellness initiatives. While there are resources available for employees who need them, they aren't always well advertised or fully utilized. More proactive support around mental health and wellness would be greatly appreciated.""]"
6,5,12,5_work_balance_workload_life,"['work', 'balance', 'workload', 'life', 'hours', 'available', 'just', 'expectation', 'home', 'difficult']","['\nEmployees in this context seem to vary widely regarding their experiences with work-life balance. Some find that their current situation provides them enough flexibility and time off to meet their personal obligations outside of work. However, other individuals express frustration over excessive', '', '', '', '', '', '', '', '', '']","['While the workload can be overwhelming at times, I appreciate that the company offers flexible work arrangements that allow me to maintain a healthy work-life balance. I just wish that the workload itself were more manageable.', ""The company's approach to work-life balance is insufficient. While the option to work from home is available, there's still an expectation that I be available at all hours and work long days. This has made it difficult for me to maintain a healthy work-life balance."", ""I appreciate the company's commitment to work-life balance, but sometimes it feels like there is a lack of support when it comes to workload management. There can be an expectation that employees take on more work than they can handle, which can lead to burnout and stress. More support from managers and colleagues would help ensure that everyone is able to manage their workload effectively. Additionally, while the option to work from home is available, there can be an expectation that employees work longer hours or be available at all hours. More guidance around work-life balance would be greatly appreciated.""]"
7,6,9,6_good_hear_wfh_comments,"['good', 'hear', 'wfh', 'comments', '', '', '', '', '', '']","['\nFrom the given materials, it can be inferred that this topic relates to remote work or working from home (WFH). The absence of any negative feedback suggests that these employees may generally feel positively towards their current situation. However, there', '', '', '', '', '', '', '', '', '']","['No comments.', 'Good', 'good to be  hear']"
8,7,7,7_feedback_reviews_performance_helpful,"['feedback', 'reviews', 'performance', 'helpful', 'year', 'receive', 'approach', 'managers', 'company', 'opportunities']","['\nEmployees at this company value constructive criticism and strive to continuously learn and develop professionally. They believe that receiving regular feedback from their managers helps them identify areas where they excel as well and those where they need growth and areas for', '', '', '', '', '', '', '', '', '']","[""The company's approach to feedback and performance reviews is outdated and unhelpful. I only receive feedback once a year, which makes it difficult to track my progress and improve in my role."", ""The company's approach to feedback and performance reviews is generally helpful, but I think there could be more opportunities for employees to provide feedback on their managers. This would help ensure that everyone is held accountable and that issues are addressed in a timely manner. Additionally, while the feedback provided during performance reviews is useful, it can be difficult to implement changes if the feedback is only provided once a year. More frequent check-ins and feedback opportunities would be beneficial for both employees and managers"", ""The company's feedback process is helpful, but could be more frequent. I appreciate the feedback I receive during performance reviews, but I think it would be more helpful to receive feedback more regularly throughout the year.""]"
